Authors,Author(s) ID,Title,Year,Source title,Volume,Issue,Art. No.,Page start,Page end,Page count,Cited by,DOI,Link,Affiliations,Authors with affiliations,Abstract,Author Keywords,Index Keywords,Document Type,Publication Stage,Open Access,Source,EID
"Sálvio G.M.M., Fontes M.A.L., Silveira Junior W.J.D., Silva H.A.D.","57190229390;7103283295;57190222851;57190227556;","Conservation areas, poverty and social inequality: An evaluation using socioeconomic indicators in Minas Gerais, Brazil [Áreas de conservação, pobreza e desigualdade social: Avaliação utilizando indicadores socioeconômicos em Minas Gerais, Brasil]",2016,"Cerne","22","2",,"145","150",,2,"10.1590/01047760201622022151","https://www.scopus.com/inward/record.uri?eid=2-s2.0-84978515004&doi=10.1590%2f01047760201622022151&partnerID=40&md5=7782c68862e943fb8a0eb99a4168b4b8","Universidade Federal de Lavras, Lavras, Minas Gerais, Brazil; Instituto Federal do Sudeste de Minas Gerais, Barbacena, Minas Gerais, Brazil","Sálvio, G.M.M., Universidade Federal de Lavras, Lavras, Minas Gerais, Brazil; Fontes, M.A.L., Universidade Federal de Lavras, Lavras, Minas Gerais, Brazil; Silveira Junior, W.J.D., Universidade Federal de Lavras, Lavras, Minas Gerais, Brazil; Silva, H.A.D., Instituto Federal do Sudeste de Minas Gerais, Barbacena, Minas Gerais, Brazil","The objective of this study was to evaluate the possible correlations between the socioeconomic development indicators of the municipalities of Minas Gerais, Brazil, and the presence of both sustainable use and full protection conservation areas (CAs). The Human Development Index (HDI) and Gini Index (GI) values were compared between municipalities with and without CAs using the non-parametric Wilcoxon-Mann-Whitney test. The correlations between the HDI and GI of each municipality and its areas occupied by CAs were analyzed using the non-parametric Spearman correlation test. A total of 560 CAs were identified in the 853 municipalities of the state. The HDI values of municipalities with CAs were not significantly different from those of other areas, but significant differences were found in the GI values, which were higher in municipalities with CAs. No significant correlations were found between the HDI of municipalities and their areas occupied by CAs. However, significant correlations were found between the GI and areas occupied by CAs, suggesting that the CAs are associated with greater socioeconomic inequalities. Populations should be included in conservation efforts through programs that benefit these individuals, such as payment for environmental services and other conservation strategies. © 2016, all rights reserved.","Gini Index; Human Development Index; Nature conservation; Protected areas","conservation planning; correlation; development strategy; environmental management; equity; human development index; nature conservation; poverty; protected area; socioeconomic indicator; socioeconomic survey; sustainability; Brazil; Minas Gerais",Article,"Final","",Scopus,2-s2.0-84978515004
"Banks-Leite C., Pardini R., Tambosi L.R., Pearse W.D., Bueno A.A., Bruscagin R.T., Condez T.H., Dixo M., Igari A.T., Martensen A.C., Metzger J.P.","24831903200;8579728300;26647097800;31367600000;35983986100;56038180000;33567455500;6504293891;26646604500;24483329600;56462138300;","Response to comment on ""Using ecological thresholds to evaluate the costs and benefits of set-asides in a biodiversity hotspot""",2015,"Science","347","6223",,"731b","",,2,"10.1126/science.aaa1602","https://www.scopus.com/inward/record.uri?eid=2-s2.0-84922901901&doi=10.1126%2fscience.aaa1602&partnerID=40&md5=73df8c622b93cabf17b3009d9367b759","Grand Challenges in the Ecosystems and Environment, Department of Life Sciences, Imperial College London, Silwood Park Campus, Ascot, SL5 7PY, United Kingdom; Departmento de Ecologia, Instituto de Biociências, Universidade de São Paulo, Rua do Matão, 321, Travessa 14, São Paulo, SP  05508-090, Brazil; Departmento de Zoologia, Instituto de Biociências, Universidade de São Paulo, Rua do Matão, 321, Travessa 14, São Paulo, SP  05508-090, Brazil; Department of Ecology, Evolution, and Behavior, University of Minnesota, 215 Ecology Building, 1987 Upper Buford Circle, Saint Paul, MN  55108, United States; Fundac¸ão Florestal, Rua do Horto, 931, São Paulo, SP  02377-000, Brazil; Departamento de Zoologia, Instituto de Biociências, Universidade Estadual Paulista, Caixa Postal 199, Rio Claro, SP  13506-900, Brazil; Curso de Gestão Ambiental, Escola de Artes, Ciências e Humanidades, Universidade de São Paulo, Avenida Arlindo Béttio, 1000, São Paulo, SP  03828-000, Brazil; Department of Ecology and Evolutionary Biology, University of Toronto, 25 Willcocks Street, Toronto, ON  M5S 3B2, Canada","Banks-Leite, C., Grand Challenges in the Ecosystems and Environment, Department of Life Sciences, Imperial College London, Silwood Park Campus, Ascot, SL5 7PY, United Kingdom, Departmento de Ecologia, Instituto de Biociências, Universidade de São Paulo, Rua do Matão, 321, Travessa 14, São Paulo, SP  05508-090, Brazil; Pardini, R., Departmento de Zoologia, Instituto de Biociências, Universidade de São Paulo, Rua do Matão, 321, Travessa 14, São Paulo, SP  05508-090, Brazil; Tambosi, L.R., Departmento de Ecologia, Instituto de Biociências, Universidade de São Paulo, Rua do Matão, 321, Travessa 14, São Paulo, SP  05508-090, Brazil; Pearse, W.D., Department of Ecology, Evolution, and Behavior, University of Minnesota, 215 Ecology Building, 1987 Upper Buford Circle, Saint Paul, MN  55108, United States; Bueno, A.A., Fundac¸ão Florestal, Rua do Horto, 931, São Paulo, SP  02377-000, Brazil; Bruscagin, R.T., Departmento de Ecologia, Instituto de Biociências, Universidade de São Paulo, Rua do Matão, 321, Travessa 14, São Paulo, SP  05508-090, Brazil; Condez, T.H., Departamento de Zoologia, Instituto de Biociências, Universidade Estadual Paulista, Caixa Postal 199, Rio Claro, SP  13506-900, Brazil; Dixo, M., Departmento de Ecologia, Instituto de Biociências, Universidade de São Paulo, Rua do Matão, 321, Travessa 14, São Paulo, SP  05508-090, Brazil; Igari, A.T., Curso de Gestão Ambiental, Escola de Artes, Ciências e Humanidades, Universidade de São Paulo, Avenida Arlindo Béttio, 1000, São Paulo, SP  03828-000, Brazil; Martensen, A.C., Department of Ecology and Evolutionary Biology, University of Toronto, 25 Willcocks Street, Toronto, ON  M5S 3B2, Canada; Metzger, J.P., Departmento de Ecologia, Instituto de Biociências, Universidade de São Paulo, Rua do Matão, 321, Travessa 14, São Paulo, SP  05508-090, Brazil","Finney claims that we did not include transaction costs while assessing the economic costs of a set-aside program in Brazil and that accounting for them could potentially render large payments for environmental services (PES) projects unfeasible. We agree with the need for a better understanding of transaction costs but provide evidence that they do not alter the feasibility of the set-aside scheme we proposed. © 2015, American Association for the Advancement of Science. All rights reserved.",,"biodiversity; cost-benefit analysis; environmental economics; feasibility study; threshold; Article; biodiversity; Brazil; budget; cost benefit analysis; cost effectiveness analysis; ecological threshold; environmental economics; environmental parameters; government; human; payment for environmental service; pilot study; priority journal; remote sensing; satellite imagery; vegetation; agriculture; animal; biodiversity; classification; economics; environmental protection; tree; vertebrate; Brazil; Agriculture; Animals; Biodiversity; Conservation of Natural Resources; Humans; Trees; Vertebrates",Article,"Final","",Scopus,2-s2.0-84922901901
"Cenamo M.C., Carrero G.C.","55246082200;42260954700;","Reducing Emissions from Deforestation and Forest Degradation (REDD) in Apuí, Southern Amazonas: Challenges and Caveats Related to Land Tenure and Governance in the Brazilian Amazon",2012,"Journal of Sustainable Forestry","31","4-5",,"445","468",,2,"10.1080/10549811.2011.588486","https://www.scopus.com/inward/record.uri?eid=2-s2.0-84861990919&doi=10.1080%2f10549811.2011.588486&partnerID=40&md5=c963cc66843b365b8e128855d777af4e","Institute for Conservation and Sustainable Development of Amazonas (IDESAM), Rua Barão de Solimões #12, Cjto. Pq., Flores, Manaus-AM, Brazil","Cenamo, M.C., Institute for Conservation and Sustainable Development of Amazonas (IDESAM), Rua Barão de Solimões #12, Cjto. Pq., Flores, Manaus-AM, Brazil; Carrero, G.C., Institute for Conservation and Sustainable Development of Amazonas (IDESAM), Rua Barão de Solimões #12, Cjto. Pq., Flores, Manaus-AM, Brazil","Climate change mitigation mechanisms related to reducing emissions from deforestation and forest degradation (REDD) may provide significant opportunities for re-arranging political networks and overcome forest governance problems, of which land tenure is the main constraint for REDD and reforestation projects in the Amazon. We present a case study of a pilot REDD project associated with reforestation and payment for environmental services in Apuí, southern Amazonas. The study emphasizes the role of local governance through an agreement aimed at re-orienting land use activities and forest management. We also present the technical, methodological, and cost-benefit studies behind the proposed framework. For instance, we found that cattle raising profitability in Apuí offers an opportunity for implementing such a pilot project. The framework proposed by the project engage stakeholders and bind together interests of governmental, non-governmental, and local civilian institutions in an agreement mechanism of mutual commitments. We highlight the related challenges and caveats, and the steps identified to overcome these hurdles. This proposal is based on a ""Zero Deforestation Pact Agreement"" that substitutes ""command and control"" mechanisms by using positive incentives. It serves as an innovative model for combating deforestation and promoting forest restoration in the Amazon by rewarding rural producers to keep forests standing. © 2012 Copyright Taylor and Francis Group, LLC.","cattle ranching; deforestation; governance; land tenure; opportunity cost; payment for environmental services; rainforest; REDD; reforestation","Cattle ranching; Environmental services; governance; Land tenure; Opportunity costs; rainforest; REDD; Conservation; Profitability; Reforestation; Revegetation; Deforestation; cattle; deforestation; degradation; emission control; forest management; governance approach; land tenure; rainforest; ranching; stakeholder; Conservation; Deforestation; Profitability; Reforestation; Amazonas [Brazil]; Brazil; Bos",Article,"Final","",Scopus,2-s2.0-84861990919
"Vilar M.B., de Oliveira A.C.C., Jacovine L.A.G., Ferreira M.G., Souza A.L.","37010118800;37009563500;6504288272;37009518600;37010149800;","Environmental valuation of farms of the Xopotó river watershed counties, MG [Valoração ambiental de propriedades rurais de municípios da bacia hidrográfica do rio Xopotó, MG]",2010,"Cerne","16","4",,"539","545",,2,"10.1590/s0104-77602010000400013","https://www.scopus.com/inward/record.uri?eid=2-s2.0-79952298892&doi=10.1590%2fs0104-77602010000400013&partnerID=40&md5=cb31c2d95e8400f06a51a1f5b156e80d","Departamento de Engenharia Florestal/DEF, Universidade Federal de Viçosa/UFV, 36570-000 - Viçosa, MG, Brazil; Universidade Federal de Viçosa/UFV, 36570-000- Viçosa, MG, Brazil","Vilar, M.B., Departamento de Engenharia Florestal/DEF, Universidade Federal de Viçosa/UFV, 36570-000 - Viçosa, MG, Brazil; de Oliveira, A.C.C., Universidade Federal de Viçosa/UFV, 36570-000- Viçosa, MG, Brazil; Jacovine, L.A.G., Departamento de Engenharia Florestal/DEF, Universidade Federal de Viçosa/UFV, 36570-000 - Viçosa, MG, Brazil; Ferreira, M.G., Departamento de Engenharia Florestal/DEF, Universidade Federal de Viçosa/UFV, 36570-000 - Viçosa, MG, Brazil; Souza, A.L., Departamento de Engenharia Florestal/DEF, Universidade Federal de Viçosa/UFV, 36570-000 - Viçosa, MG, Brazil","The studies of environmental economy are based on the understanding that environmental conservation and improvements can be executed through the use of economic instruments. However, to use these instruments, it is necessary to understand the economic value of the environment. The environmental resources and services values can be estimated by the knowledge of the society willingness to pay (WTP) for their preservation. Inside of this perspective, a socioeconomic and environmental diagnosis was accomplished on the Xopotó River Watershed. The diagnosis aimed at estimating the environmental value of 40 farms distributed in four counties of this watershed. Through the adaptation of the Willingness to Pay (WTP) methodology, the Willingness to Receive (WTR) of each farmer to immobilize areas in their farms to ensure the provision of environmental services was estimated. The Xopotó River Watershed is undergoing great pressures that endanger the promotion of environmental services. The value of the WTR revealed by the farmers to maintain preserved areas of important environmental functions in their farms corresponds, on average, to R$160,00.(ha.year)-1. This value is closed to that one which is already practiced in some payment for environmental services initiatives in Brazil. This value serve as reference for implementation of public policies, which would recognize the farmers as environmental services producers, motivating them to continue exercising these services for the human survival.","Environmental compensation; Environmental economy; Environmental services","agricultural land; conservation management; environmental economics; environmental values; estimation method; immobilization; implementation process; policy making; resource use; socioeconomic conditions; watershed; willingness to pay; Madagascar",Article,"Final","",Scopus,2-s2.0-79952298892
"Fasiaben M.C.R., Andrade D.C., Reydon B.P., Garcia J.R., Romeiro A.R.","36337700400;36337602300;8613637200;36337892900;23568707200;","Estimation of resources allocation for a system of environmental services payment in the brazilian amazon rainforest [Estimativa de aporte de recursos para um sistema de Pagamento por Serviços Ambientais na floresta Amazônica brasileira]",2009,"Ambiente e Sociedade","12","2",,"223","239+405",,2,"10.1590/s1414-753x2009000200002","https://www.scopus.com/inward/record.uri?eid=2-s2.0-77955519513&doi=10.1590%2fs1414-753x2009000200002&partnerID=40&md5=edb4fc7f5a099cd2cbda125fe821e724","Empresa Brasileira de Pesquisa Agropecuária, Secretaria de Gestão e Estratégia, Embrapa Sede, Parque Estação Biológica, s/no, CEP 70.770-901, Brasília - DF, Brazil; Instituto de Economia da Universidade Federal de Uberlândia, Avenida João Naves de Ávila, 2121, Bloco J, Bairro Santa Maria, CEP 38.408-100, Uberlândia - MG, Brazil; Instituto de Economia da Universidade Estadual de Campinas, Núcleo de Economia Agrícola e do Meio Ambiente, Caixa Postal 6135, CEP 13.083-857, Campinas - SP, Brazil; Desenvolvimento Econômico pelo Instituto de Economia, Universidade Estadual de Campinas, Caixa Postal 6135, CEP 13.083-857, Campinas - SP, Brazil","Fasiaben, M.C.R., Empresa Brasileira de Pesquisa Agropecuária, Secretaria de Gestão e Estratégia, Embrapa Sede, Parque Estação Biológica, s/no, CEP 70.770-901, Brasília - DF, Brazil; Andrade, D.C., Instituto de Economia da Universidade Federal de Uberlândia, Avenida João Naves de Ávila, 2121, Bloco J, Bairro Santa Maria, CEP 38.408-100, Uberlândia - MG, Brazil; Reydon, B.P., Instituto de Economia da Universidade Estadual de Campinas, Núcleo de Economia Agrícola e do Meio Ambiente, Caixa Postal 6135, CEP 13.083-857, Campinas - SP, Brazil; Garcia, J.R., Desenvolvimento Econômico pelo Instituto de Economia, Universidade Estadual de Campinas, Caixa Postal 6135, CEP 13.083-857, Campinas - SP, Brazil; Romeiro, A.R., Instituto de Economia da Universidade Estadual de Campinas, Núcleo de Economia Agrícola e do Meio Ambiente, Caixa Postal 6135, CEP 13.083-857, Campinas - SP, Brazil","This paper offers an appraisal of a mechanism of Payments for Environmental Services (PES) in the Brazilian Amazon Rainforest. The estimates were performed for two regions: the Arc of Deforestation and the Legal Amazon. The estimates were based on a cost of opportunity of R$ 123.00 per hectare and the definition of the eligible public was based on the area and the income generated by the farms in these two areas.","Arc of deforestation; Brazilian amazon; Deforestation; Environmental services; PES",,Article,"Final","",Scopus,2-s2.0-77955519513
"Lemos C.M.G., Andrade P.R., Rodrigues R.R., Hissa L., Aguiar A.P.D.","57189525555;26326156300;7103188195;36172251100;7005379013;","Combining regional to local restoration goals in the Brazilian Atlantic forest",2021,"Regional Environmental Change","21","3","68","","",,1,"10.1007/s10113-021-01792-0","https://www.scopus.com/inward/record.uri?eid=2-s2.0-85108448160&doi=10.1007%2fs10113-021-01792-0&partnerID=40&md5=8fe83996a572437472f94cbf9fbee937","Brazilian Institute of Space Research (INPE), São José dos Campos, SP  12227-010, Brazil; University of São Paulo, Piracicaba, SP  13418-900, Brazil; Center for Conservation and Sustainability, Smithsonian Institution, Washington, DC  20013, United States; Stockholm Resilience Center, Stockholm University, Stockholm, SE-114 19, Sweden","Lemos, C.M.G., Brazilian Institute of Space Research (INPE), São José dos Campos, SP  12227-010, Brazil; Andrade, P.R., Brazilian Institute of Space Research (INPE), São José dos Campos, SP  12227-010, Brazil; Rodrigues, R.R., University of São Paulo, Piracicaba, SP  13418-900, Brazil; Hissa, L., Center for Conservation and Sustainability, Smithsonian Institution, Washington, DC  20013, United States; Aguiar, A.P.D., Brazilian Institute of Space Research (INPE), São José dos Campos, SP  12227-010, Brazil, Stockholm Resilience Center, Stockholm University, Stockholm, SE-114 19, Sweden","To achieve regional and international large-scale restoration goals with minimum costs, several restoration commitments rely on natural regeneration, a passive and inexpensive strategy. However, natural regeneration potential may vary within the landscape, mainly due to its historical context. In this work, we use spatially explicit restoration scenarios to explore how and where, within a given region, multiple restoration commitments could be combined to achieve cost-effectiveness outcomes. Our goal is to facilitate the elaboration of forest restoration plans at the regional level, taking into consideration the costs for active and passive restoration methods. The approach includes (1) a statistical analysis to estimate the natural regeneration potential for a given area based on alternative sets of biophysical, land cover, and/or socioeconomic factors and (2) the use of a land change allocation model to explore the cost-effectiveness of combining multiple restoration commitments in a given area through alternative scenarios. We test our approach in a strategic region in the Brazilian Atlantic Forest Biome, the Paraiba Valley in São Paulo State. Using the available data for 2011, calibrated for 2015, we build alternative scenarios for allocating natural regeneration until 2025. Our models indicate that the natural regeneration potential of the region is actually very low, and the cost-effectiveness outcomes are similar for all scenarios. We believe our approach can be used to support the regional-level decision-making about the implementation of multiple commitments aiming at the same target area. It can also be combined with other approaches for more refined analysis (e.g., optimization models). © 2021, The Author(s).","Cost-effectiveness; Ecological forest restoration; Land change models; Payments for environmental services; Restoration methods; Restoration planning",,Article,"Final","",Scopus,2-s2.0-85108448160
"Perevochtchikova M., Castro-Díaz R., Langle-Flores A., Von Thaden Ugalde J.J.","56000829100;55859485600;57194653568;57214939049;","A systematic review of scientific publications on the effects of payments for ecosystem services in Latin America, 2000–2020",2021,"Ecosystem Services","49",,"101270","","",,1,"10.1016/j.ecoser.2021.101270","https://www.scopus.com/inward/record.uri?eid=2-s2.0-85102656778&doi=10.1016%2fj.ecoser.2021.101270&partnerID=40&md5=9100766fa81e351f7a926f24d13efac7","Centro de Estudios Demográficos Urbanos y Ambientales (CEDUA), El Colegio de México A.C, Ciudad de México, Mexico; Instituto de Ciências Humanas e da Informação (ICHI), Universidade Federal do Rio Grande (FURG), Rio Grande, Brazil; Centro Universitario de la Costa, Universidad de Guadalajara. Av. Universidad 203, Delegación Ixtapa, C.P. 48280, Puerto Vallarta, Jalisco, Mexico; Instituto de Ecología A.C. (INECOL), Carretera antigua a Coatepec #351, Col El Haya Xalapa, C.P. 91073, Mexico","Perevochtchikova, M., Centro de Estudios Demográficos Urbanos y Ambientales (CEDUA), El Colegio de México A.C, Ciudad de México, Mexico; Castro-Díaz, R., Instituto de Ciências Humanas e da Informação (ICHI), Universidade Federal do Rio Grande (FURG), Rio Grande, Brazil; Langle-Flores, A., Centro Universitario de la Costa, Universidad de Guadalajara. Av. Universidad 203, Delegación Ixtapa, C.P. 48280, Puerto Vallarta, Jalisco, Mexico; Von Thaden Ugalde, J.J., Instituto de Ecología A.C. (INECOL), Carretera antigua a Coatepec #351, Col El Haya Xalapa, C.P. 91073, Mexico","This article presents a systematic review of scientific publications on the effects of payments for ecosystem services (PES) schemes in Latin America (LA) from 2000–2020. A multi-dimensional perspective, using the Search, Appraisal, Synthesis, Analysis (SALSA) framework was followed to explore, describe and determine the PES effect in scientific articles indexed in Scopus, SciELO and Redalyc databases. We applied the qualitative method to describe the PES schemes, principal trends and general tendencies in studies reported in 72 pre-selected publications. The qualitative analysis included methodological steps, such as search, article screening, coding, data extraction, analysis and synthesis. Our review reveals that PES schemes in Latin America are primarily supported by public funds that are implemented at national scale with an average timescale of five years. The schemes are largely oriented toward conservation goals, hydrological modality and forestry systems, and are dominated by the traditional disciplinary approaches. The predominant effects of the schemes are mainly related to positive weak changes on environmental, social and economic aspects. In addition, collaboration among co-authors involved the USA, Mexico, Spain, Brazil, Costa Rica and the UK (including an important percentage of publications with authors from non-LA countries), with incipient LA intercountry co-workers. Results from this systematic review highlight issues that represent future challenges for studies of PES effects and open further dialog to improve the effectiveness of compensation programs to reduce the replication of undesirable impacts, lack of additionality, and the pursuit of perverse incentives regarding the complexity of social-ecological systems. © 2021","Evidence synthesis; PES effects; SALSA framework; Semantic network analysis; State of art",,Article,"Final","",Scopus,2-s2.0-85102656778
