Authors,Author(s) ID,Title,Year,Source title,Volume,Issue,Art. No.,Page start,Page end,Page count,Cited by,DOI,Link,Affiliations,Authors with affiliations,Abstract,Author Keywords,Index Keywords,Document Type,Publication Stage,Open Access,Source,EID
"Seroa da Motta R., Ortiz R.A.","24293255300;33167737800;","Costs and Perceptions Conditioning Willingness to Accept Payments for Ecosystem Services in a Brazilian Case",2018,"Ecological Economics","147",,,"333","342",,29,"10.1016/j.ecolecon.2018.01.032","https://www.scopus.com/inward/record.uri?eid=2-s2.0-85044376329&doi=10.1016%2fj.ecolecon.2018.01.032&partnerID=40&md5=122fe03518fa741a2312431fef85cdeb","State University of Rio de Janeiro, UERJ, Av. Borges de Medeiros 3709 ap. 401, Lagoa, Rio de Janeiro, RJ  22470-001, Brazil; Rio de Janeiro Town Hall, Rua Leite Leal, 99 apto 16, Laranjeiras, Rio de Janeiro, RJ  22240-100, Brazil","Seroa da Motta, R., State University of Rio de Janeiro, UERJ, Av. Borges de Medeiros 3709 ap. 401, Lagoa, Rio de Janeiro, RJ  22470-001, Brazil; Ortiz, R.A., Rio de Janeiro Town Hall, Rua Leite Leal, 99 apto 16, Laranjeiras, Rio de Janeiro, RJ  22240-100, Brazil","This study analyzes the willingness of farmers to accept payments for ecosystem services in the Paraíba do Sul River basin applying a contingent valuation methodology. Ecosystem services would be those resulting from forest conservation and regeneration and sustainable and innovative production practices. The results suggest a regressive bias when some variables that capture the income effect positively affect participation in the program and acceptance of the payment offered. There is also evidence of adverse selection when acceptance of the amount offered is more sensitive to the service provision already being suited to the modes of production adopted. The results, on the other hand, indicate that farmers' decisions to join the program depend not only on their opportunity costs, but also on their perceptions about specific issues, such as their environmental knowledge or awareness, inertia to change production modes, fear of additional monitoring, and level of understanding of the program. These results are important to support the program's outreach strategies and the design of mechanisms for the selection of beneficiaries and pricing of payments. © 2018 Elsevier B.V.","Contingent valuation; Payment for ecosystem services; Willingness to accept payment","contingent valuation; cost; decision making; ecosystem service; environmental economics; farmers attitude; perception; service provision; willingness to pay; Brazil; Paraiba do Sul Basin",Article,"Final","",Scopus,2-s2.0-85044376329
"Sone J.S., Gesualdo G.C., Zamboni P.A.P., Vieira N.O.M., Mattos T.S., Carvalho G.A., Rodrigues D.B.B., Alves Sobrinho T., Oliveira P.T.S.","57204803274;57204806198;57204799515;57204801638;57190260074;57204798776;35748669200;55772516400;35748383000;","Water provisioning improvement through payment for ecosystem services",2019,"Science of the Total Environment","655",,,"1197","1206",,28,"10.1016/j.scitotenv.2018.11.319","https://www.scopus.com/inward/record.uri?eid=2-s2.0-85057262728&doi=10.1016%2fj.scitotenv.2018.11.319&partnerID=40&md5=f027e9815d3001cc692c863d8841593e","Federal University of Mato Grosso do Sul, CxP 549, Campo Grande, MS  79070-900, Brazil","Sone, J.S., Federal University of Mato Grosso do Sul, CxP 549, Campo Grande, MS  79070-900, Brazil; Gesualdo, G.C., Federal University of Mato Grosso do Sul, CxP 549, Campo Grande, MS  79070-900, Brazil; Zamboni, P.A.P., Federal University of Mato Grosso do Sul, CxP 549, Campo Grande, MS  79070-900, Brazil; Vieira, N.O.M., Federal University of Mato Grosso do Sul, CxP 549, Campo Grande, MS  79070-900, Brazil; Mattos, T.S., Federal University of Mato Grosso do Sul, CxP 549, Campo Grande, MS  79070-900, Brazil; Carvalho, G.A., Federal University of Mato Grosso do Sul, CxP 549, Campo Grande, MS  79070-900, Brazil; Rodrigues, D.B.B., Federal University of Mato Grosso do Sul, CxP 549, Campo Grande, MS  79070-900, Brazil; Alves Sobrinho, T., Federal University of Mato Grosso do Sul, CxP 549, Campo Grande, MS  79070-900, Brazil; Oliveira, P.T.S., Federal University of Mato Grosso do Sul, CxP 549, Campo Grande, MS  79070-900, Brazil","We assess whether a Payments for Ecosystem Services (PES) programme met its objectives of reducing soil erosion and yielding water in an environmental protected area, the Guariroba River Basin, Midwestern Brazil. We measured rainfall and water discharge throughout 2012 and 2016. During the same period, soil and water conservation practices were performed in the basin, such as: building level terraces and riparian vegetation recovery. We separated streamflow into baseflow and direct runoff, then we evaluted the baseflow index that indicated that groundwater significantly contributes to total flow. Therefore, to investigate the effects on streamflow, we performed a trend analysis in the baseflow time series using the Mann-Kendall test. In addition, we analysed the efficiency of soil erosion regulation practices over time, considering the total payment and the trends found in the baseflow. Whereas precipitation records present a decreasing trend (1 mm month−1), baseflow tends to increase by 0.018 m3 s−1 in the same period. Our findings show that soil conservation practices performed in the basin increase baseflow and also provide a better resilience to endure extreme events such as drought based on an increase in forest areas and soil conservation practices such as level terrace. © 2018","Payment for ecosystem services; Soil and water conservation; Water yield","Ecosystems; Erosion; Groundwater; Historic preservation; Runoff; Soil conservation; Soils; Stream flow; Time series analysis; Conservation practices; Ecosystem services; Environmental Protected Area; Mann-Kendall test; Payments for ecosystem services (PES); Riparian vegetation; Soil and water conservation; Water yield; Water conservation; ground water; rain; baseflow; ecosystem service; extreme event; runoff; soil conservation; soil erosion; streamflow; water management; water yield; Article; Brazil; drought; ecosystem; ecosystem resilience; environmental economics; forest; precipitation; priority journal; riparian ecosystem; river basin; soil erosion; stream (river); trend study; vegetation; water conservation; water flow; water supply; Brazil",Article,"Final","",Scopus,2-s2.0-85057262728
"Demczuk A., Padula A.D.","57192958619;34971803400;","Using system dynamics modeling to evaluate the feasibility of ethanol supply chain in Brazil: The role of sugarcane yield, gasoline prices and sales tax rates",2017,"Biomass and Bioenergy","97",,,"186","211",,27,"10.1016/j.biombioe.2016.12.021","https://www.scopus.com/inward/record.uri?eid=2-s2.0-85009458848&doi=10.1016%2fj.biombioe.2016.12.021&partnerID=40&md5=ce0189c4b4b962666fccfea7e8475a41","Petróleo Brasileiro - Petrobras S.A., Av Getúlio Vargas 11001 - Bairro São José, Canoas, RS  92420-221, Brazil; Universidade Federal do Rio Grande do Sul – UFRGS, Escola de Administração - EA, Programa de Pós-Graduação em Administração – PPGA, Rua Washington Luis, 855, Porto Alegre, RS  90010-460, Brazil","Demczuk, A., Petróleo Brasileiro - Petrobras S.A., Av Getúlio Vargas 11001 - Bairro São José, Canoas, RS  92420-221, Brazil; Padula, A.D., Universidade Federal do Rio Grande do Sul – UFRGS, Escola de Administração - EA, Programa de Pós-Graduação em Administração – PPGA, Rua Washington Luis, 855, Porto Alegre, RS  90010-460, Brazil","This paper explores how sugarcane yield, gasoline prices and sales tax rates affect the production and consumption of ethanol from sugarcane in Brazil. The system dynamics model of the sugarcane and ethanol production chain explores the impact of these variables to evaluate the feasibility of ethanol production. Using the VENSIM software different arrangements for sugarcane yield, gasoline prices and sales tax were simulated (horizon of 20 years). Brazil's Federal Government policy of gasoline price below the international price and the diversity of state sales tax rates produce distortions in the ethanol market and impose considerable constraints on the development of the ethanol industry. The simulations show that to ensure the feasibility of ethanol production, the pump price of regular gasoline would need to be US$1.95 per liter, which is far higher than the US$1.26 per liter currently charged. Public policies involving the liberalization of gasoline prices and the homogenization of the sales taxes on ethanol among the Brazilian states could reduce the distortions caused by these policies. These policies could contribute to reduce uncertainty in the ethanol sector and encourage technological and productive investments. Future research could add and evaluate the impacts of the environmental benefits of ethanol production and consumption (Carbon Trade Market, Payment for Environmental Services and Bioelectricity production) and of sugarcane byproducts on its feasibility. The sensitivity analysis revealed the effectiveness of the model to support policies and managerial decisionmaking process in the sugarcane ethanol sector. © 2016 Elsevier Ltd","Ethanol supply chain; Feasibility; Gasoline prices; Sugarcane yield; System dynamics; Tax rates","Byproducts; Carbon; Costs; Electrophysiology; Energy policy; Ethanol; Gasoline; Investments; Public policy; Sales; Sensitivity analysis; Supply chains; System theory; Feasibility; Gasoline prices; Sugarcane yield; System Dynamics; Tax rates; Taxation; biofuel; crop yield; ethanol; feasibility study; federal system; fuel consumption; liberalization; policy making; price dynamics; sensitivity analysis; software; sugar cane; supply chain management; tax system; Brazil",Article,"Final","",Scopus,2-s2.0-85009458848
"Wünscher T., Engel S., Wunder S.","7801660160;8670489200;7003871913;","Payments for environmental services in Costa Rica: Increasing efficiency through spatial differentiation",2006,"Quarterly Journal of International Agriculture","45","4 SPEC. ISS.",,"319","337",,27,,"https://www.scopus.com/inward/record.uri?eid=2-s2.0-33845868494&partnerID=40&md5=71afd3e15ec6954a820b2164db629410","Center for Development Research (ZEF), Walter-Flex-Str. 3, 53113 Bonn, Germany; ETH Zurich, Zurich, Switzerland; Center for International Forestry Research (CIFOR), Belem, Brazil","Wünscher, T., Center for Development Research (ZEF), Walter-Flex-Str. 3, 53113 Bonn, Germany; Engel, S., ETH Zurich, Zurich, Switzerland; Wunder, S., Center for International Forestry Research (CIFOR), Belem, Brazil","Costa Rica was the first developing country to have implemented a nation-wide program of payments for environmental services. We analyze whether the efficiency of the program could be increased through better targeting techniques and propose a targeting mechanism which takes into account the spatial diversity of service provision and opportunity cost. Given a fixed budget we show that selecting sites according to their service delivery potential increases the amount of contracted services. The efficiency increase is even more pronounced when opportunity costs are taken into account and payment levels are varied accordingly. We also observe that the use of the above mentioned concepts decreases the average area of the selected, sites which might indicate that the proposed approaches encourage participation of the poor.","Conservation; Costa Rica; Environmental services; Payment; Targeting","developing world; efficiency measurement; environmental protection; service provision; spatial variation; Central America; Costa Rica",Article,"Final","",Scopus,2-s2.0-33845868494
"Garrett R.D., Ryschawy J., Bell L.W., Cortner O., Ferreira J., Garik A.V.N., Gil J.D.B., Klerkx L., Moraine M., Peterson C.A., Dos Reis J.C., Valentim J.F.","37661304800;55346230100;9334808200;57194235927;18436550200;57216389953;56421346300;13612931800;55240298600;57200578604;7003435386;55991079900;","Drivers of decoupling and recoupling of crop and livestock systems at farm and territorial scales",2020,"Ecology and Society","25","1","24","","",,25,"10.5751/ES-11412-250124","https://www.scopus.com/inward/record.uri?eid=2-s2.0-85083399284&doi=10.5751%2fES-11412-250124&partnerID=40&md5=b9c783029eb521baa3d7e8519126aff4","Environmental Policy Group, Departments of Environmental Systems Science and Humanities, Social, and Political Sciences, ETH Zürich, Zürich, Switzerland; Department of Earth and Environment, Boston UniversityMA, United States; AGIR, Université de Toulouse, INPT, INRAE, France; CSIRO Agriculture and Food, Toowoomba, QLD, Australia; Embrapa Amazônia Oriental, Belém, Brazil; Plant Production Systems, Wageningen University, Wageningen, Netherlands; Knowledge, Technology and Innovation Group, Wageningen University, Netherlands; UMR 0951 INNOVATION, INRAE, CIRAD, Montpellier SupAgro, Montpellier, France; Department of Plant Sciences, University of California, Davis, CA, United States; Embrapa Agrossilvipastoril, Sinop, Mato Grosso, Brazil; Agroforestry Research Center of Acre, Embrapa Acre, Rio Branco, Acre, Brazil","Garrett, R.D., Environmental Policy Group, Departments of Environmental Systems Science and Humanities, Social, and Political Sciences, ETH Zürich, Zürich, Switzerland, Department of Earth and Environment, Boston UniversityMA, United States; Ryschawy, J., AGIR, Université de Toulouse, INPT, INRAE, France; Bell, L.W., CSIRO Agriculture and Food, Toowoomba, QLD, Australia; Cortner, O., Environmental Policy Group, Departments of Environmental Systems Science and Humanities, Social, and Political Sciences, ETH Zürich, Zürich, Switzerland, Department of Earth and Environment, Boston UniversityMA, United States; Ferreira, J., Embrapa Amazônia Oriental, Belém, Brazil; Garik, A.V.N., Department of Earth and Environment, Boston UniversityMA, United States; Gil, J.D.B., Plant Production Systems, Wageningen University, Wageningen, Netherlands; Klerkx, L., Knowledge, Technology and Innovation Group, Wageningen University, Netherlands; Moraine, M., UMR 0951 INNOVATION, INRAE, CIRAD, Montpellier SupAgro, Montpellier, France; Peterson, C.A., Department of Plant Sciences, University of California, Davis, CA, United States; Dos Reis, J.C., Embrapa Agrossilvipastoril, Sinop, Mato Grosso, Brazil; Valentim, J.F., Agroforestry Research Center of Acre, Embrapa Acre, Rio Branco, Acre, Brazil","Crop and livestock production have become spatially decoupled in existing commercial agricultural regimes throughout the world. These segregated high input production systems contribute to some of the world’s most pressing sustainability challenges, including climate change, nutrient imbalances, water pollution, biodiversity decline, and increasingly precarious rural livelihoods. There is substantial evidence that by closing the loop in nutrient and energy cycles, recoupling crop and livestock systems at farm and territorial scales can help reduce the environmental externalities associated with conventional commercial farming without declines in profitability or yields. Yet such “integrated” crop and livestock systems remain rare as a proportion of global agricultural area. Based on an interdisciplinary workshop and additional literature review, we provide a comprehensive historical and international perspective on why integrated crop and livestock systems have declined in most regions and what conditions have fostered their persistence and reemergence in others. We also identify levers for encouraging the reemergence of integrated crop and livestock systems worldwide. We conclude that a major disruption of the current regime would be needed to foster crop-livestock reintegration, including a redesign of research programs, credit systems, payments for ecosystem services, insurance programs, and food safety regulations to focus on whole farm outcomes and the creation of a circular economy. An expansion of the number of integrated crop and livestock systems field trials and demonstrations and efforts to brand integrated crop and livestock systems as a form of sustainable agriculture through the development of eco-labels could also improve adoption, but would likely be unsuccessful at encouraging wide-scale change without a more radical transformation of the research and policy landscape. © 2020 by the author(s).","Innovation; Integrated crop livestock systems; Mixed farming systems; Socio-technical transitions; Sustainable agriculture; Technology adoption","alternative agriculture; crop production; farm; livestock farming; production system; sustainability",Article,"Final","",Scopus,2-s2.0-85083399284
"Campos F.S., Lourenço-de-Moraes R., Llorente G.A., Solé M.","48361058100;54784913400;6603797315;56239976200;","Cost-effective conservation of amphibian ecology and evolution",2017,"Science Advances","3","6","Y","","",,25,"10.1126/sciadv.1602929","https://www.scopus.com/inward/record.uri?eid=2-s2.0-85041731423&doi=10.1126%2fsciadv.1602929&partnerID=40&md5=1c9380cb5177fd9eb4d25e2c9560d5f7","Departament de Biologia Evolutiva, Ecologia i Ciències Ambientals, Facultat de Biologia, Universitat de Barcelona, Barcelona, ES-08028, Spain; Coordination for the Improvement of Higher Education Personnel Foundation, Ministry of Education of Brazil, Brasília, Distrito Federal, 70040-020, Brazil; Laboratório de Herpetologia e Comportamento Animal, Departamento de Ecologia, Universidade Federal de Goiás, Goiânia, Goiás, 74001-970, Brazil; Departamento de Ciências Biológicas, Universidade Estadual de Santa Cruz, Ilhéus, Bahia, 45662-000, Brazil","Campos, F.S., Departament de Biologia Evolutiva, Ecologia i Ciències Ambientals, Facultat de Biologia, Universitat de Barcelona, Barcelona, ES-08028, Spain, Coordination for the Improvement of Higher Education Personnel Foundation, Ministry of Education of Brazil, Brasília, Distrito Federal, 70040-020, Brazil; Lourenço-de-Moraes, R., Laboratório de Herpetologia e Comportamento Animal, Departamento de Ecologia, Universidade Federal de Goiás, Goiânia, Goiás, 74001-970, Brazil; Llorente, G.A., Departament de Biologia Evolutiva, Ecologia i Ciències Ambientals, Facultat de Biologia, Universitat de Barcelona, Barcelona, ES-08028, Spain; Solé, M., Departamento de Ciências Biológicas, Universidade Estadual de Santa Cruz, Ilhéus, Bahia, 45662-000, Brazil","Habitat loss is the most important threat to species survival, and the efficient selection of priority areas is fundamental for good systematic conservation planning. Using amphibians as a conservation target, we designed an innovative assessment strategy, showing that prioritization models focused on functional, phylogenetic, and taxonomic diversity can include cost-effectiveness–based assessments of land values. We report new key conservation sites within the Brazilian Atlantic Forest hot spot, revealing a congruence of ecological and evolutionary patterns. We suggest payment for ecosystem services through environmental set-asides on private land, establishing potential tradeoffs for ecological and evolutionary processes. Our findings introduce additional effective area-based conservation parameters that set new priorities for biodiversity assessment in the Atlantic Forest, validating the usefulness of a novel approach to cost-effectiveness–based assessments of conservation value for other species-rich regions. Copyright © 2017 The Authors, some rights reserved;",,"Biodiversity; Cost effectiveness; Costs; Ecology; Ecosystems; Forestry; Brazilian Atlantic forests; Conservation targets; Conservation values; Ecosystem services; Evolutionary process; Innovative assessment; Systematic conservation planning; Taxonomic diversity; Conservation; Amphibia; animal; biodiversity; cost benefit analysis; ecosystem; environmental protection; evolution; forest; geography; Amphibians; Animals; Biodiversity; Biological Evolution; Conservation of Natural Resources; Cost-Benefit Analysis; Ecosystem; Forests; Geography",Article,"Final","",Scopus,2-s2.0-85041731423
"Wertz-Kanounnikoff S., Locatelli B., Wunder S., Brockhaus M.","35186650000;8611587300;7003871913;51565722800;","Ecosystem-based adaptation to climate change: What scope for payments for environmental services?",2011,"Climate and Development","3","2",,"143","158",,24,"10.1080/17565529.2011.582277","https://www.scopus.com/inward/record.uri?eid=2-s2.0-84857745793&doi=10.1080%2f17565529.2011.582277&partnerID=40&md5=3833e316cda9e5ed5891f89a35d98455","Center for International Forestry Research (CIFOR), Maputo, Mozambique; CIRAD, UPR Forest Resources, Montpellier, France; CIFOR, Rua do Russel 450, s/601, Glória, RJ, Brazil; CIFOR, Situ Gede, Bogor Barat, 16115, Bogor, Indonesia","Wertz-Kanounnikoff, S., Center for International Forestry Research (CIFOR), Maputo, Mozambique; Locatelli, B., CIRAD, UPR Forest Resources, Montpellier, France, CIFOR, Situ Gede, Bogor Barat, 16115, Bogor, Indonesia; Wunder, S., CIFOR, Rua do Russel 450, s/601, Glória, RJ, Brazil; Brockhaus, M., CIFOR, Situ Gede, Bogor Barat, 16115, Bogor, Indonesia","In recent years, there has been a growing interest in payments for environmental services (PES) for ecosystem-based adaptation (EBA). So far, however, experiences and theoretical analyses of PES specifically for adaptation have not been well documented. This paper addresses this gap by analysing the opportunities and constraints of PES as an instrument for EBA. Specifically, we examine the potential for PES to address key elements for adaptation by focusing on three pathways: the user side, the provider side and institutional and societal change. In addition, we assess whether PES fulfils key requirements for adaptation policy instruments, notably effectiveness, efficiency, equity and legitimacy. We find that PES are not a panacea for all environmental services and country contexts, but can be promising adaptation policy instruments where certain preconditions are met and synergies prevail. We conclude on four points especially relevant for the practical scope for PES-adaptation synergies: (i) natural adaptation co-benefits (where the targeted environmental service serves a dual function, e.g. secured water quality and increased adaptive capacity), (ii) piggy-backing (where adaptation benefits are coincidental outcomes), (iii) adaptation-relevant institutional and sectoral spillovers from PES schemes, and (iv) direct payments for adaptation benefits. © 2011 Earthscan.","Adaptation; Ecosystem-based adaptation; Payments for environmental services","adaptive management; climate change; ecosystem service; environmental economics; environmental legislation; theoretical study",Article,"Final","",Scopus,2-s2.0-84857745793
