Authors,Author(s) ID,Title,Year,Source title,Volume,Issue,Art. No.,Page start,Page end,Page count,Cited by,DOI,Link,Affiliations,Authors with affiliations,Abstract,Author Keywords,Index Keywords,Document Type,Publication Stage,Open Access,Source,EID
"Quijas S., Boit A., Thonicke K., Murray-Tortarolo G., Mwampamba T., Skutsch M., Simoes M., Ascarrunz N., Peña-Claros M., Jones L., Arets E., Jaramillo V.J., Lazos E., Toledo M., Martorano L.G., Ferraz R., Balvanera P.","6503954796;35304742900;9535263000;55867125000;16309839200;6505918222;55522790800;36097778200;6506552133;34771306700;7801392109;56013886200;24329934300;7005885891;33667692300;57200887119;6602239231;","Modelling carbon stock and carbon sequestration ecosystem services for policy design: a comprehensive approach using a dynamic vegetation model",2019,"Ecosystems and People","15","1",,"42","60",,7,"10.1080/26395908.2018.1542413","https://www.scopus.com/inward/record.uri?eid=2-s2.0-85065873286&doi=10.1080%2f26395908.2018.1542413&partnerID=40&md5=faef50b5b12a326d271b0116e2eca2ad","Centro Universitario de la Costa, Universidad de Guadalajara, Puerto Vallarta, Mexico; Institute of Biochemistry and Biology, University of Potsdam, Potsdam, Germany; Research Domain I Earth System Analysis, Potsdam Institute for Climate Impact, Research, Potsdam, Germany; Instituto de Investigaciones en Ecosistemas y Sustentabilidad, Universidad Nacional Autónoma de México, Morelia, Mexico; Centro de Investigaciones en Geografía Ambiental, Universidad Nacional Autónoma de, México, Morelia, Mexico; Research and Development, EMBRAPA Solos, Rio de Janeiro, Brazil; Department of Computer Engineering, Rio de Janeiro State University (UERJ/FEN/DESC/PPGMA), Rio de Janeiro, Brazil; Executive Direction, Instituto Boliviano de Investigación Forestal, Santa Cruz de la Sierra, Bolivia; Forest Ecology and Forest Management Group, Wageningen University, Wageningen, Netherlands; Centre for Ecology & Hydrology, Natural Environment Research Council, Bangor, United Kingdom; Wageningen Environmental Research, Wageningen UR, Wageningen, Netherlands; Instituto de Investigaciones Sociales, Universidad Nacional Autónoma de México, Ciudad de Mexico, Mexico; Research Cordination, Instituto Boliviano de Investigación Forestal, Santa Cruz de la Sierra, Bolivia; Agrometeorology, EMBRAPA Eastern Amazon, Belém, Brazil","Quijas, S., Centro Universitario de la Costa, Universidad de Guadalajara, Puerto Vallarta, Mexico; Boit, A., Institute of Biochemistry and Biology, University of Potsdam, Potsdam, Germany; Thonicke, K., Research Domain I Earth System Analysis, Potsdam Institute for Climate Impact, Research, Potsdam, Germany; Murray-Tortarolo, G., Instituto de Investigaciones en Ecosistemas y Sustentabilidad, Universidad Nacional Autónoma de México, Morelia, Mexico; Mwampamba, T., Instituto de Investigaciones en Ecosistemas y Sustentabilidad, Universidad Nacional Autónoma de México, Morelia, Mexico; Skutsch, M., Centro de Investigaciones en Geografía Ambiental, Universidad Nacional Autónoma de, México, Morelia, Mexico; Simoes, M., Research and Development, EMBRAPA Solos, Rio de Janeiro, Brazil, Department of Computer Engineering, Rio de Janeiro State University (UERJ/FEN/DESC/PPGMA), Rio de Janeiro, Brazil; Ascarrunz, N., Executive Direction, Instituto Boliviano de Investigación Forestal, Santa Cruz de la Sierra, Bolivia; Peña-Claros, M., Forest Ecology and Forest Management Group, Wageningen University, Wageningen, Netherlands; Jones, L., Centre for Ecology & Hydrology, Natural Environment Research Council, Bangor, United Kingdom; Arets, E., Wageningen Environmental Research, Wageningen UR, Wageningen, Netherlands; Jaramillo, V.J., Instituto de Investigaciones en Ecosistemas y Sustentabilidad, Universidad Nacional Autónoma de México, Morelia, Mexico; Lazos, E., Instituto de Investigaciones Sociales, Universidad Nacional Autónoma de México, Ciudad de Mexico, Mexico; Toledo, M., Research Cordination, Instituto Boliviano de Investigación Forestal, Santa Cruz de la Sierra, Bolivia; Martorano, L.G., Agrometeorology, EMBRAPA Eastern Amazon, Belém, Brazil; Ferraz, R., Research and Development, EMBRAPA Solos, Rio de Janeiro, Brazil; Balvanera, P., Instituto de Investigaciones en Ecosistemas y Sustentabilidad, Universidad Nacional Autónoma de México, Morelia, Mexico","Ecosystem service (ES) models can only inform policy design adequately if they incorporate ecological processes. We used the Lund-Potsdam-Jena managed Land (LPJmL) model, to address following questions for Mexico, Bolivia and Brazilian Amazon: (i) How different are C stocks and C sequestration quantifications under standard (when soil and litter C and heterotrophic respiration are not considered) and comprehensive (including all C stock and heterotrophic respiration) approach? and (ii) How does the valuation of C stock and C sequestration differ in national payments for ES and global C funds or markets when comparing both approach? We found that up to 65% of C stocks have not been taken into account by neglecting to include C stored in soil and litter, resulting in gross underpayments (up to 500 times lower). Since emissions from heterotrophic respiration of organic material offset a large proportion of C gained through growth of living matter, we found that markets and decision-makers are inadvertently overestimating up to 100 times C sequestrated. New approaches for modelling C services relevant ecological process-based can help accounting for C in soil, litter and heterotrophic respiration and become important for the operationalization of agreements on climate change mitigation following the COP21 in 2015. © 2018, © 2018 The Author(s). Published by Informa UK Limited, trading as Taylor & Francis Group.","carbon litter; Carbon soil; Christine Fürst; decision-makers; dynamic global vegetation model; global carbon markets; heterotrophic respiration; payment for ecosystem services","carbon emission; carbon sequestration; climate change; decision making; ecological modeling; ecosystem service; growth; market conditions; modeling; respiration; soil carbon; soil respiration; Amazonia; Bolivia; Mexico [North America]",Article,"Final","",Scopus,2-s2.0-85065873286
"Alves-Pinto H.N., Hawes J.E., Newton P., Feltran-Barbieri R., Peres C.A.","56181305000;23134859100;56002786300;38761225000;7005085103;","Economic Impacts of Payments for Environmental Services on Livelihoods of Agro-extractivist Communities in the Brazilian Amazon",2018,"Ecological Economics","152",,,"378","388",,7,"10.1016/j.ecolecon.2018.05.016","https://www.scopus.com/inward/record.uri?eid=2-s2.0-85049349896&doi=10.1016%2fj.ecolecon.2018.05.016&partnerID=40&md5=095dcc33274b0e07362eeca3919a2807","School of Environmental Sciences, University of East Anglia, Norwich Research Park, Norwich, NR4 7TJ, United Kingdom; International Institute for Sustainability, Estrada Dona Castorina 124, CEP, Rio de Janeiro, 22460-320, Brazil; Programa de Pós Graduação em Ecologia, Universidade Federal do Rio de Janeiro, Rio de Janeiro, CEP 21941-590, Brazil; Applied Ecology Research Group, Department of Biology, Anglia Ruskin University, East Road, Cambridge, CB1 1PT, United Kingdom; Environmental Studies Program, Sustainability, Energy and Environment Community, University of Colorado Boulder, 4001 Discovery Drive, Boulder, CO  80303, United States; World Resources Institute (WRI-Brasil), Rua Claudio Soares 72, CEP, São Paulo, 05422-030, Brazil","Alves-Pinto, H.N., School of Environmental Sciences, University of East Anglia, Norwich Research Park, Norwich, NR4 7TJ, United Kingdom, International Institute for Sustainability, Estrada Dona Castorina 124, CEP, Rio de Janeiro, 22460-320, Brazil, Programa de Pós Graduação em Ecologia, Universidade Federal do Rio de Janeiro, Rio de Janeiro, CEP 21941-590, Brazil; Hawes, J.E., Applied Ecology Research Group, Department of Biology, Anglia Ruskin University, East Road, Cambridge, CB1 1PT, United Kingdom; Newton, P., Environmental Studies Program, Sustainability, Energy and Environment Community, University of Colorado Boulder, 4001 Discovery Drive, Boulder, CO  80303, United States; Feltran-Barbieri, R., World Resources Institute (WRI-Brasil), Rua Claudio Soares 72, CEP, São Paulo, 05422-030, Brazil; Peres, C.A., School of Environmental Sciences, University of East Anglia, Norwich Research Park, Norwich, NR4 7TJ, United Kingdom","Rural communities in the Brazilian Amazon rely on manioc, produced in a swidden-fallow system that uses land cleared from forest areas. Increased agricultural production could reduce fallow period length with implications for manioc flour (farinha) production. We hypothesize that payments for environmental services (PES) programs may exacerbate reduction of fallow periods, thereby reducing per stem farinha productivity. To understand the household scale economic impacts of avoided deforestation under PES programs, we conducted interviews in 158 households from 32 communities in the Brazilian state of Amazonas. Using regression models, we assessed which variables most influenced farinha production, and calculated production costs and total revenues, with and without a PES program. Manioc yield increased by 22.83 kg per household per year for each additional year that the forest was left to recover before being cleared. Although production costs were higher for land cleared from older secondary forests, net profits on land cleared from primary forests were still higher. Total income from PES programs, when added to the secondary forest manioc profit, were higher than the foregone production in primary forest areas. However, when we considered only direct cash payments, we identified potential trade-offs. We conclude that PES programmes should consider possible long-term effects of payments on the livelihoods of participants. © 2018 Elsevier B.V.","Agriculture; Bolsa Floresta; Bolsa Verde; Deforestation; Manioc; PES","agricultural production; cost analysis; crop yield; deforestation; economic impact; ecosystem service; environmental economics; forest ecosystem; livelihood; rural population; secondary forest; Amazonas [Brazil]; Amazonia; Brazil; Manihot esculenta",Article,"Final","",Scopus,2-s2.0-85049349896
"Guerra R.","55618947100;","Assessing preconditions for implementing a Payment for Environmental Services initiative in Cotriguaçu (Mato Grosso, Brazil)",2016,"Ecosystem Services","21",,,"31","38",,7,"10.1016/j.ecoser.2016.07.009","https://www.scopus.com/inward/record.uri?eid=2-s2.0-84979527256&doi=10.1016%2fj.ecoser.2016.07.009&partnerID=40&md5=1948b919d7c37b6a486d1660f14c9d48","Amazon Environmental Research Institute (IPAM), Brazil","Guerra, R., Amazon Environmental Research Institute (IPAM), Brazil","The success of Payments for Environmental Services (PES) projects depends, in a large part, on the respect to the necessary conditions for implementing it. These preconditions are seldom studied in the literature and few authors exploit this subject. They are mostly concerned about analyzing if experiences fit the concept of PES or are successful, instead of understanding the reasons of this success. There are, thought, few authors concerned about the relevance on making ex ante analysis and looking at some preconditions, such as informational, economic, cultural, institutional, and competitive preconditions. This paper is concerned about a previous investigation of a project called Cotriguaçu Sempre Verde (CSV) in Mato Grosso and the extent to which it would be able to shelter a PES. All of these conditions were analyzed and sustained the decision taken by proponents of the initiative to not include a PES in the project. This analysis will contribute knowledge to stakeholders that are designing and implementing PES projects, and it should be part of the protocol for all PES initiatives. © 2016 Elsevier B.V.","Amazon; Brazil; Cotriguaçu Sempre Verde Project (CSV); Ex ante assessment; Payments for Environmental Services",,Article,"Final","",Scopus,2-s2.0-84979527256
"Chiodi R.E., Sarcinelli O., Uezu A.","55976611500;57209349755;24077537100;","Management of water resources in the Cantareira water producer system area: A look at the rural context [Gestão dos recursos hídricos na área do sistema produtor de água Cantareira: Um olhar para o contexto rural]",2013,"Revista Ambiente e Agua","8","3",,"151","165",,7,"10.4136/ambi-agua.1162","https://www.scopus.com/inward/record.uri?eid=2-s2.0-84891060916&doi=10.4136%2fambi-agua.1162&partnerID=40&md5=59d95ea70c929cf391de28c9858c40a3","Universidade de São Paulo/ESALQ, Piracicaba, São Paulo, Brazil; Universidade Estadual de Campinas/IE, Campinas, São Paulo, Brazil; Conservação Ambiental e Sustentabilidade/IPÊ, Nazaré Paulista, São Paulo, Brazil","Chiodi, R.E., Universidade de São Paulo/ESALQ, Piracicaba, São Paulo, Brazil; Sarcinelli, O., Universidade Estadual de Campinas/IE, Campinas, São Paulo, Brazil; Uezu, A., Conservação Ambiental e Sustentabilidade/IPÊ, Nazaré Paulista, São Paulo, Brazil","The National Water Resources Policy established the principles of participation, integration and decentralization, as well as new instruments for the management of water resources in Brazil. The implementation of this policy created several challenges, such as establishing effective management within the framework of rural territorial structure. The example of the Cantareira's System in Piracicaba river watershed is conducive to the understanding of this challenge. In this scenario, we analyzed the effective implementation of principles, and of two instruments of water resource management from the perspective of farmers' participation: the integration of water management and rural land use, and public policies for rural areas. To accomplish this, we reviewed documents and literature, and considered conclusions drawn from meetings at the Technical Chamber of Use and Water Conservation in Rural Areas (CT-Rural). We identified a lack of participation by farmers' representatives in the CT-Rural Chamber and little concern to increase their participation in the management practices. However, the support payments for environmental services projects (PES) are stimulating farmers and calling attention to the Cantareira area, in addition to promoting the integration of water resource management and rural land use. However, even though this support acknowledges the importance of the farmers, we emphasize the low priority given by the Piracicaba, Capivari and Jundiaí Watershed Committee to the rural context of the area studied.","Cantareira system; Rural development; Water resources",,Article,"Final","",Scopus,2-s2.0-84891060916
"Metzger J.P., Fidelman P., Sattler C., Schröter B., Maron M., Eigenbrod F., Fortin M.-J., Hohlenwerger C., Rhodes J.R.","56462138300;37076971500;15766400600;57014994700;8619526000;57200302294;35568173200;57221103509;57211633993;","Connecting governance interventions to ecosystem services provision: A social-ecological network approach",2021,"People and Nature","3","2",,"266","280",,6,"10.1002/pan3.10172","https://www.scopus.com/inward/record.uri?eid=2-s2.0-85106259437&doi=10.1002%2fpan3.10172&partnerID=40&md5=0c494cf2658d3aeb081f5487b868c1fa","Department of Ecology, Institute of Biosciences, University of São Paulo, São Paulo, Brazil; Centre for Policy Futures, The University of Queensland, Brisbane, Qld, Australia; Leibniz Centre for Agricultural Landscape Research (ZALF), Working Group: Governance of Ecosystem Services, Müncheberg, Germany; School of Earth and Environmental Sciences, The University of Queensland, Brisbane, Qld, Australia; School of Geography and Environmental Science, University of Southampton, Southampton, United Kingdom; Department of Ecology and Evolutionary Biology, University of Toronto, Toronto, ON, Canada","Metzger, J.P., Department of Ecology, Institute of Biosciences, University of São Paulo, São Paulo, Brazil; Fidelman, P., Centre for Policy Futures, The University of Queensland, Brisbane, Qld, Australia; Sattler, C., Leibniz Centre for Agricultural Landscape Research (ZALF), Working Group: Governance of Ecosystem Services, Müncheberg, Germany; Schröter, B., Leibniz Centre for Agricultural Landscape Research (ZALF), Working Group: Governance of Ecosystem Services, Müncheberg, Germany; Maron, M., School of Earth and Environmental Sciences, The University of Queensland, Brisbane, Qld, Australia; Eigenbrod, F., School of Geography and Environmental Science, University of Southampton, Southampton, United Kingdom; Fortin, M.-J., Department of Ecology and Evolutionary Biology, University of Toronto, Toronto, ON, Canada; Hohlenwerger, C., Department of Ecology, Institute of Biosciences, University of São Paulo, São Paulo, Brazil; Rhodes, J.R., School of Earth and Environmental Sciences, The University of Queensland, Brisbane, Qld, Australia","The fulfilment of the benefits resulting from services provided by nature requires an integrated framework that combines appropriate ecosystem service governance with spatially explicit models of service provision. Here, we propose using a social-ecological network approach to develop a ‘landscape governance framework’ that identifies how different types of governance can act on supply, demand and flow of ecosystem services through changes in landscape structure and connections. Starting from undesirable situations where demand exceeds supply, we exemplify the application of this conceptual model considering hierarchical (e.g. creation of protected areas), market (e.g. payments for environmental services) and community-based (e.g. enhancing links between stakeholders) governance approaches. We show how interventions associated with each of these approaches act in distinct ways to regulate different components of the service provision chain in heterogeneous landscapes. Filling such knowledge gaps can help identify appropriate governance interventions depending on factors that limit provision: restricted supply, demand or flow. The application of the landscape governance framework entails challenges related to availability of data and limited understanding of key underlying mechanisms. However, it opens important new research questions at the interface between governance and ecosystem services, with great potential as a tool for landscape management that aims to achieve ecosystem service sustainability. A free Plain Language Summary can be found within the Supporting Information of this article. © 2020 The Authors. People and Nature published by John Wiley & Sons Ltd on behalf of British Ecological Society","demand and flows; ecosystem services governance; ecosystem services supply; landscape governance; social-ecological network; spatial planning; sustainability",,Article,"Final","",Scopus,2-s2.0-85106259437
"Viani R.A.G., Bracale H., Taffarello D.","21744403800;57211922340;24512736100;","Lessons learned from thewater producer project in the atlantic forest, Brazil",2019,"Forests","10","11","1031","","",,5,"10.3390/f10111031","https://www.scopus.com/inward/record.uri?eid=2-s2.0-85075349313&doi=10.3390%2ff10111031&partnerID=40&md5=3b092d2f860ef8d1589d5ac2b4618b80","Department of Biotechnology and Plant and Animal Production, Federal University of São Carlos (UFSCar), Araras-SP, 13600-970, Brazil; The Nature Conservancy, São Paulo-SP, 01311-936, Brazil; Department of Hydraulics and Sanitation (SHS, EESC), University of São Paulo (USP), São Carlos-SP, 13566-590, Brazil","Viani, R.A.G., Department of Biotechnology and Plant and Animal Production, Federal University of São Carlos (UFSCar), Araras-SP, 13600-970, Brazil; Bracale, H., The Nature Conservancy, São Paulo-SP, 01311-936, Brazil; Taffarello, D., Department of Hydraulics and Sanitation (SHS, EESC), University of São Paulo (USP), São Carlos-SP, 13566-590, Brazil","Forest and landscape restoration (FLR) is a powerful strategy for large-scale tropical forest recovery, and payment for ecosystem services (PES) is used to support FLR programs and projects on privately-owned land. In this article, we discuss the lessons learned from the Water Producer Project, a pioneer, multiple-stakeholder, and PES-supported FLR project in the Atlantic Forest, south-eastern Brazil. The project was implemented in four landscapes located in two municipalities. Altogether, 41 PES contracts with landowners were signed, resulting in various FLR practices being implemented in a total of 342.4 ha (64.2 ha for riparian forest restoration, 90.8 ha for soil conservation, and 187.4 for forest conservation) of land, which represents 39% of the project goal. As of the end of the project, only 50% (USD 49,250) of the available PES funds had been spent. However, funds spent on project planning, implementation, communication, and monitoring were 12 times greater than those spent on PES. Several challenges restricted the progress and monitoring of the project. The main issue was landowner participation and/or engagement. In terms of lessons learned, we highlight that PES schemes are more complex than initially thought, and that sufficient funding does not guarantee the success of FLR projects. It is essential to promote landowner participation and engagement by considering them key players in FLR projects. Finally, acceptance from landowners was higher and implementation was easier for forest conservation practices that required no land-use changes. Thus, we suggest that similar future projects should focus on targeting private properties in marginal agricultural lands with a high probability of natural regeneration. Alternatively, future projects could focus on lands with remnant forest cover of high conservation value. © 2019 by the authors.","Ecological restoration; Forest and landscape restoration; Forest restoration; Landowner engagement; Payment for ecosystem services; Tropical forest; Water","Ecosystems; Land reclamation; Land use; Restoration; Soil conservation; Water; Ecological restoration; Ecosystem services; Forest restoration; Landowner engagement; Landscape restoration; Tropical forest; Reforestation; ecosystem service; forest ecosystem; land use change; landowner; participatory approach; restoration ecology; Ecosystems; Land Reclamation; Land Use; Reforestation; Restoration; Water; Atlantic Forest",Article,"Final","",Scopus,2-s2.0-85075349313
"Campanhão L.M.B., Ranieri V.E.L.","57208083389;16242391900;","Guideline framework for effective targeting of payments for watershed services",2019,"Forest Policy and Economics","104",,,"93","109",,5,"10.1016/j.forpol.2019.04.002","https://www.scopus.com/inward/record.uri?eid=2-s2.0-85064641883&doi=10.1016%2fj.forpol.2019.04.002&partnerID=40&md5=f53c3ce4e95752dc94da4f7f23c2a1fa","Escola de Engenharia de São Carlos, Universidade de São Paulo, Avenida Trabalhador São-Carlense, 400, São Carlos, SP  13566-590, Brazil","Campanhão, L.M.B., Escola de Engenharia de São Carlos, Universidade de São Paulo, Avenida Trabalhador São-Carlense, 400, São Carlos, SP  13566-590, Brazil; Ranieri, V.E.L., Escola de Engenharia de São Carlos, Universidade de São Paulo, Avenida Trabalhador São-Carlense, 400, São Carlos, SP  13566-590, Brazil","Payments for Watershed Services (PWS) have become popular for the conservation of environmental services. As effectiveness is influenced by PWS design and the local contexts in which they are implemented, deficiencies in the process of targeting providers can affect the success of PWS schemes in achieving their goals. This article presents a framework based on data obtained from systematic reviews of worldwide Payments for Environmental Services (PES) schemes and the scientific literature to guide the process of targeting PWS schemes, especially in rural private areas in fragmented landscapes. The framework comprises four sets of operational guidelines for the targeting process based on the scientific literature. A table explaining the data extracted from the literature and PES schemes is provided, comprising the targeting criteria of benefits, risk, cost, socioeconomic issues, and readiness. The framework supplements current approaches that focus on biophysical criteria and is the first initiative to incorporate multidimensional aspects of PES in targeting guidelines. As it gathers empirical and scientific knowledge to promote an effective scheme design, the framework can contribute to the achievement of PWS goals. © 2019 Elsevier B.V.","Payments for environmental services; Prioritization; Priority areas; Targeting; Watershed schemes; Watershed services","Economics; Forestry; Environmental services; Fragmented landscapes; Operational guidelines; Payments for environmental services; Prioritization; Priority areas; Scientific literature; Targeting; Watersheds",Article,"Final","",Scopus,2-s2.0-85064641883
